key,key:project,code,instantiationMoment,providerName,customerName,goals,budget
contract-00,project-01,MSN-048,2022/07/29 23:50,中華,Global Enterprises,Desarrollo e implementación de un sistema de gestión de recursos humanos.,750
contract-01,project-01,ABC-123,2010/05/15 08:00,Provider García,Customer Pérez,Ejemplo de goals,1000
contract-02,project-01,CIA-533,2014/02/12 08:00,ACME,Junta de Andalucía,Implementar un sistema de gestión de inventario.,94000
contract-03,project-04,ALO-033,2003/07/24 02:00,Energy Corp.,Junta de Andalucía,Implementar un sistema de gestión de automóviles.,1040
contract-04,project-05,ESP-007,2018/11/14 01:00,_,_,_,1
contract-05,project-05,DUB-001,2011/11/11 11:11,GlobalTech Innovations Inc.: Empowering Businesses with Advanced Technology,Advanced Solutions 564325: Enhancing Business Operations Through Innovation,Implementar un sistema de gestión eficiente y escalable para optimizar procesos y aumentar la MSF32.,100000
